{"event_id":"11111111-1111-4111-8111-111111111115","event_type":"access.revoke.succeeded.v1","schema_version":1,"occurred_at":"2026-08-18T12:00:05Z","producer":"provisioning-service","correlation_id":"22222222-2222-4222-8222-222222222222","causation_id":"11111111-1111-4111-8111-111111111112","aggregate_type":"credential","aggregate_id":"44444444-4444-4444-8444-444444444444","aggregate_sequence":2,"partition_key":"credential:44444444-4444-4444-8444-444444444444","data":{"operation_id":"55555555-5555-4555-8555-555555555556","credential_id":"44444444-4444-4444-8444-444444444444","desired_revision":2,"allocation_revision":1,"all_assigned_nodes_removed":true,"node_ids":["66666666-6666-4666-8666-666666666666","77777777-7777-4777-8777-777777777777"],"revoked_at":"2026-08-18T12:00:05Z"}}
